{
  "$schema": "http://json-schema.org/draft-07/schema#",
  "type": "object",
  "required": ["generatedAt", "repoRoot", "packages", "apps", "docs", "routes", "envVars", "apiEndpoints", "entities"],
  "properties": {
    "generatedAt": { "type": "string" },
    "repoRoot": { "type": "string" },
    "packages": { "type": "array", "items": { "type": "string" } },
    "apps": { "type": "array", "items": { "type": "string" } },
    "docs": { "type": "array", "items": { "type": "string" } },
    "routes": { "type": "array" },
    "envVars": { "type": "array" },
    "apiEndpoints": { "type": "array" },
    "entities": { "type": "array" }
  }
}
